Nome;Descrição;Data Inicio;Data Fim;Imagem
Vencedor DPUM: C;Vencedor do desafio de programação em C;04/02/2019;09/02/2019;images/Desafios/fstc.png
Vencedor DPUM: Haskell;Vencedor do desafio de programação em Haskell;04/02/2019;09/02/2019;images/Desafios/fsth.png
Vencedor DPUM: Livre;;04/02/2019;09/02/2019;images/Desafios/livre.png
Vencedor do desafio de fotografia;Vencedor do desafio de fotografia;04/02/2019;09/02/2019;images/Desafios/fstphoto.png
Desafio de fotografia;Participaste no desafio de fotografia;04/02/2019;09/02/2019;images/Desafios/participantefoto.png
DPUM;Participaste no desafio de programação;04/02/2019;09/02/2019;images/Desafios/participantedpum.png
Desafio de segurança;Participaste no desafio de Segurança;04/02/2019;09/02/2019;images/Desafios/participantesegurança.png
Vencedor do desafio de segurança;Vencedor do desafio de segurança;04/02/2019;09/02/2019;images/Desafios/fstseg.png
